{
  "title": "房主设置主持分成比例灰盒增强测试用例",
  "project": "合成验收/主持分成",
  "generated_at": "2026-07-22T00:00:00Z",
  "excel_font": "SimHei",
  "case_contract": "requirement-test-case-v1",
  "skill_invocation": {"primary": "enhanced-graybox-test-case-generation"},
  "sheets": [
    {
      "name": "正式测试用例",
      "kind": "test_cases",
      "columns": ["用例 ID", "所属模块", "用例标题", "验证功能点", "前置条件", "测试步骤", "预期结果", "优先级", "执行结果（通过 / 不通过 / 未执行）", "备注"],
      "rows": [
        {"values": ["1", "主流程", "房主设置本房管理员整数比例", "1. 验证合法角色与对象\n2. 验证保存和立即展示", "1. 准备房主A和本房管理员B\n2. 管理员B当前比例为20%", "1. 房主A进入本房管理员列表\n2. 打开管理员B的分成设置\n3. 输入30并保存\n4. 刷新页面并重新进入", "1. 保存成功\n2. 页面、详情和重新进入后均展示30%\n3. 其他管理员比例不变", "P0", "未执行", "需求1/2/5；主流程"]},
        {"values": ["2", "默认值", "新管理员默认比例为20%", "1. 验证新管理员默认值\n2. 验证多端一致", "1. 准备房主A和尚未成为管理员的用户C", "1. 房主A将用户C设为本房管理员\n2. 分别在Android、iOS和Admin查看C", "1. 各端均展示20%\n2. 接口返回20且后续收益按20%计算", "P0", "未执行", "需求4"]},
        {"values": ["3", "边界", "比例下边界0可保存", "1. 验证0边界\n2. 验证Android限制与需求一致", "1. 准备房主A和本房管理员B\n2. 使用Android客户端", "1. 进入分成设置\n2. 输入0并保存\n3. 重新进入页面", "1. Android允许提交0\n2. 保存后展示0%\n3. 新收益分成为0", "P0", "未执行", "D01；需求3"]},
        {"values": ["4", "边界", "比例上边界100可保存", "1. 验证100边界\n2. 验证Android限制与需求一致", "1. 准备房主A和本房管理员B\n2. 使用Android客户端", "1. 进入分成设置\n2. 输入100并保存\n3. 重新进入页面", "1. Android允许提交100\n2. 保存后展示100%\n3. 新收益按100%计算", "P0", "未执行", "D01；需求3"]},
        {"values": ["5", "输入校验", "小数比例在各入口均被拒绝", "1. 验证整数规则\n2. 验证客户端和服务端一致", "1. 准备房主A和本房管理员B\n2. 可使用iOS及手工接口工具", "1. iOS输入20.5并尝试保存\n2. 向比例设置接口提交20.5\n3. 重新查询管理员B", "1. iOS阻止提交或展示明确整数提示\n2. 接口拒绝小数\n3. 原比例和收益口径不变", "P0", "未执行", "D02、D04；需求3"]},
        {"values": ["6", "权限", "非房主不能设置比例", "1. 验证角色权限\n2. 验证绕过页面后的服务端拦截", "1. 准备本房普通管理员D和目标管理员B\n2. 记录B原比例", "1. 使用管理员D登录\n2. 确认页面无设置入口\n3. 使用D的凭据向设置接口提交B的新比例", "1. 页面不提供设置入口\n2. 接口返回无权限\n3. B的比例、缓存和收益口径均不变", "P0", "未执行", "D03；需求1；静态疑点待手工验证"]},
        {"values": ["7", "数据归属", "房主不能设置其他房间管理员", "1. 验证跨房间对象权限\n2. 验证伪造对象ID被拦截", "1. 准备房主A、A房间和另一房间管理员E\n2. 记录E原比例", "1. 使用房主A的凭据请求设置管理员E\n2. 在A房间和E所属房间分别重查", "1. 请求被拒绝并提示对象不属于本房\n2. E比例、两房间列表和收益口径均不变", "P0", "未执行", "D05；需求2"]},
        {"values": ["8", "历史兼容", "空比例历史数据按默认口径展示", "1. 验证可空字段兼容\n2. 避免页面和结算异常", "1. 准备比例缺失的历史管理员F\n2. 准备可查看F的房主账号", "1. 打开F的管理员详情\n2. 查询接口展示\n3. 产生一笔新主持收益并查看结算", "1. 页面和接口不展示空白或报错\n2. 按产品确认的默认20%口径展示和结算\n3. 各端结果一致", "P1", "未执行", "D06；需求4；若默认迁移口径未确认则转待产品确认"]},
        {"values": ["9", "Admin", "Admin只能查看不能覆盖比例", "1. 验证后台只读权限\n2. 验证绕过页面后的保护", "1. 准备Admin账号和已有比例的管理员B", "1. 在Admin打开B的比例信息\n2. 尝试编辑或提交覆盖请求\n3. 由房主端重查", "1. Admin字段只读且无保存入口\n2. 覆盖请求被拒绝\n3. 房主端比例不变", "P0", "未执行", "D07；需求9"]},
        {"values": ["10", "缓存一致性", "修改后多账号立即看到新比例", "1. 验证Redis更新或失效\n2. 验证修改立即展示", "1. 准备房主A、管理员B和另一可查看账号G\n2. B原比例20%", "1. 房主A将B改为35%\n2. B和G分别刷新列表、详情并重新登录重查\n3. 在缓存TTL前后各查询一次", "1. 保存后各账号立即展示35%\n2. 重新登录和TTL前后结果一致\n3. 不短暂回退到20%", "P0", "未执行", "D08；需求5；待动态验证缓存失效"]},
        {"values": ["11", "结算", "修改前后收益按产生时比例分界", "1. 验证新旧收益分界\n2. 验证异步结算不读取错误时点", "1. 管理员B比例20%\n2. 准备可分别识别的收益R1和R2", "1. 在20%时产生收益R1但暂不等待结算完成\n2. 房主改为40%\n3. 修改后产生收益R2\n4. 等待队列处理并重查明细", "1. R1始终按20%结算\n2. R2按40%结算\n3. 重试或延迟消费不改变两笔口径", "P0", "未执行", "D09；需求6/7；待动态验证队列消费时点"]},
        {"values": ["12", "取消管理员", "取消后比例和缓存立即失效", "1. 验证角色取消后的状态\n2. 验证缓存残留不会继续生效", "1. 管理员B比例35%\n2. 准备房主A和另一查看账号G", "1. 房主A取消B的管理员身份\n2. A、B、G刷新并重新进入\n3. 尝试查询或使用B的旧比例产生收益", "1. B立即不再显示为管理员\n2. 旧比例不再可见或生效\n3. 新收益不按旧比例结算", "P0", "未执行", "D10；需求8；待动态验证缓存删除"]},
        {"values": ["13", "审计日志", "修改日志包含完整前后值", "1. 验证审计字段\n2. 验证多次修改可追溯", "1. B原比例20%\n2. 准备房主A和日志查看权限", "1. 房主A将B改为30%\n2. 再将B改为40%\n3. 查看两次操作日志", "1. 每条日志包含操作人、修改前值、修改后值和准确时间\n2. 两次记录顺序及前后值连续", "P1", "未执行", "D11；需求10"]},
        {"values": ["14", "Android异常", "Android正确展示服务端错误信息", "1. 验证响应字段解析\n2. 验证失败后状态不变", "1. 准备Android客户端和非房主账号D\n2. 记录目标比例", "1. 使用D尝试设置比例并触发权限失败\n2. 观察Android提示\n3. 返回列表重查", "1. Android展示接口返回的明确权限提示而非空提示\n2. 页面可继续操作\n3. 原比例不变", "P1", "未执行", "D12；多端错误响应一致性"]},
        {"values": ["15", "多端一致性", "Android、iOS和接口展示同一比例", "1. 验证多端参数与展示一致\n2. 验证数据库和结算闭环", "1. 房主A将B比例设为45%\n2. 准备Android、iOS和接口访问条件", "1. 各端重新登录并查看B\n2. 调用查询接口\n3. 产生一笔新收益并查看结算", "1. Android、iOS、接口和结算均使用45%\n2. 无小数、空值或旧缓存口径", "P0", "未执行", "D01、D02、D06、D08；需求11"]},
        {"values": ["16", "修改生效", "连续修改只影响各自之后的新收益", "1. 验证多次修改时间边界\n2. 验证最终一致性", "1. B初始比例20%\n2. 准备三笔可区分收益数据", "1. 产生收益R1\n2. 改为30%后产生R2\n3. 改为40%后产生R3\n4. 等待结算并重查", "1. R1、R2、R3分别按20%、30%、40%结算\n2. 页面始终展示最新40%", "P0", "未执行", "D09；需求5/6/7"]},
        {"values": ["17", "失败恢复", "保存失败后可重试且不产生半成功状态", "1. 验证失败恢复\n2. 验证页面、接口和缓存一致", "1. B原比例20%\n2. 准备可模拟一次请求失败的测试环境", "1. 房主输入30并提交失败\n2. 刷新和重进确认状态\n3. 恢复网络后再次提交", "1. 首次失败后仍展示20%且无新日志\n2. 重试成功后统一展示30%且仅有一条有效日志", "P1", "未执行", "需求异常恢复；D08、D11关联回归"]},
        {"values": ["18", "回归", "比例变更不影响无关管理员和历史报表", "1. 验证最小充分回归范围\n2. 验证历史数据兼容", "1. 准备同房管理员B/H及历史收益报表\n2. 仅修改B比例", "1. 修改B后查看H的比例和收益\n2. 查看修改前历史报表、列表和统计\n3. 查看修改后新增记录", "1. H数据不变\n2. 历史报表不被重算\n3. 仅B修改后的新增收益采用新比例", "P1", "未执行", "公共字段和结算链路回归"]}
      ]
    },
    {
      "name": "需求与实现差异",
      "kind": "supplementary",
      "columns": ["差异 ID", "实现证据", "测试处理"],
      "rows": [
        {"values": ["D01", "Android只允许1～99", "正式用例3、4、15"]},
        {"values": ["D02", "iOS允许小数", "正式用例5、15"]},
        {"values": ["D03", "后端未校验房主身份", "正式用例6"]},
        {"values": ["D04", "后端接受小数", "正式用例5"]},
        {"values": ["D05", "后端允许操作其他房间管理员", "正式用例7"]},
        {"values": ["D06", "数据库字段允许null", "正式用例8、15"]},
        {"values": ["D07", "Admin可以修改比例", "正式用例9"]},
        {"values": ["D08", "Redis修改后未清理", "正式用例10、15；待动态验证"]},
        {"values": ["D09", "Queue消费时读取最新比例", "正式用例11、16；待动态验证"]},
        {"values": ["D10", "取消管理员后缓存未删除", "正式用例12；待动态验证"]},
        {"values": ["D11", "修改日志缺少旧值", "正式用例13、17"]},
        {"values": ["D12", "Android读取错误响应字段", "正式用例14"]}
      ]
    },
    {
      "name": "待动态验证",
      "kind": "supplementary",
      "columns": ["线索", "静态证据", "执行方式", "关联用例"],
      "rows": [
        {"values": ["DV01", "D08 Redis失效未定位", "修改后由多账号在TTL前后刷新、重登并重查", "10、15"]},
        {"values": ["DV02", "D09 Queue读取当前比例", "创建修改前后两笔收益，等待消费并核对结算分界", "11、16"]},
        {"values": ["DV03", "D10 取消时缓存删除未定位", "取消后多账号重查并尝试产生新收益", "12"]}
      ]
    }
  ]
}
